{
  "uid": "ent_30419",
  "type": "system",
  "expression": {
    "name": "System Existence",
    "slug": "system--existence",
    "aliases": []
  },
  "created_at": "2026-04-05T03:18:22.194182+00:00",
  "heartbeats": {
    "formal_locus": "LAWS.md",
    "operational_locus": "/",
    "governance_locus": "GH-#6"
  }
}