{
  "uid": "ent_D2E46",
  "type": "derivation",
  "expression": {
    "name": "Parallel Studies \u2014 Seven",
    "slug": "derivation--parallel-studies",
    "aliases": []
  },
  "created_at": "2026-04-05T17:20:44.938881+00:00",
  "heartbeats": {
    "operational_locus": "parallel-studies--seven.md",
    "formal_locus": "ATM-P-001:ATM-P-010",
    "governance_locus": "GH-#8"
  }
}
