{
  "uid": "ent_B8A48",
  "type": "derivation",
  "expression": {
    "name": "Verification \u2014 Truth Striving",
    "slug": "derivation--truth-striving",
    "aliases": []
  },
  "created_at": "2026-04-05T17:20:47.080880+00:00",
  "heartbeats": {
    "operational_locus": "verification--truth-striving.md",
    "formal_locus": "derivation--truth-striving",
    "governance_locus": "GH-#8"
  }
}
