{
  "uid": "ent_3452E",
  "type": "axiom",
  "expression": {
    "name": "Isomorphic Validation",
    "slug": "axiom--isomorphism",
    "aliases": []
  },
  "created_at": "2026-04-05T17:20:31.090683+00:00",
  "heartbeats": {
    "operational_locus": "system--isomorphism.md",
    "formal_locus": "Law-6",
    "governance_locus": "GH-#7"
  }
}
