{
  "uid": "ent_201CB",
  "type": "derivation",
  "expression": {
    "name": "Existence Critique",
    "slug": "derivation--existence-critique",
    "aliases": []
  },
  "created_at": "2026-04-05T17:20:48.102397+00:00",
  "heartbeats": {
    "operational_locus": "existence--critique.md",
    "formal_locus": "derivation--existence-critique",
    "governance_locus": "GH-#8"
  }
}
