{
  "uid": "ent_4E79B",
  "type": "derivation",
  "expression": {
    "name": "Escrow Protocol",
    "slug": "derivation--escrow-protocol",
    "aliases": []
  },
  "created_at": "2026-04-05T17:20:50.787518+00:00",
  "heartbeats": {
    "operational_locus": "escrow-protocol.md",
    "formal_locus": "IRF-SYS-060",
    "governance_locus": "GH-#8"
  }
}
