{
  "uid": "ent_534B8",
  "type": "primitive",
  "expression": {
    "name": "Programmable Materia (Materon)",
    "slug": "primitive--materon",
    "aliases": []
  },
  "created_at": "2026-04-05T03:28:38.064349+00:00",
  "heartbeats": {
    "formal_locus": "ATM-M-005:ATM-M-021",
    "operational_locus": "materon--formalization.md",
    "governance_locus": "GH-#5"
  }
}
