{
  "uid": "ent_2247D",
  "type": "axiom",
  "expression": {
    "name": "Primitive Stratification",
    "slug": "axiom--stratification",
    "aliases": []
  },
  "created_at": "2026-04-05T17:20:28.465499+00:00",
  "heartbeats": {
    "operational_locus": "stratification--primitives.md",
    "formal_locus": "ATM-P-011:ATM-P-021",
    "governance_locus": "GH-#7"
  }
}
