{
  "uid": "ent_A804E",
  "type": "derivation",
  "expression": {
    "name": "Governance Teleology",
    "slug": "derivation--governance-teleology",
    "aliases": []
  },
  "created_at": "2026-04-05T17:20:51.505163+00:00",
  "heartbeats": {
    "operational_locus": "governance--teleology.md",
    "formal_locus": "derivation--governance-teleology",
    "governance_locus": "GH-#8"
  }
}
