{
  "uid": "ent_0705E",
  "type": "axiom",
  "expression": {
    "name": "Scale Invariance",
    "slug": "axiom--scale-invariance",
    "aliases": []
  },
  "created_at": "2026-04-05T17:20:29.530393+00:00",
  "heartbeats": {
    "operational_locus": "scale--invariance.md",
    "formal_locus": "ATM-M-001:ATM-M-004",
    "governance_locus": "GH-#7"
  }
}
