{
  "uid": "ent_E786E",
  "type": "derivation",
  "expression": {
    "name": "Plane Existence Variables",
    "slug": "derivation--plane-existence",
    "aliases": []
  },
  "created_at": "2026-04-05T17:20:47.245017+00:00",
  "heartbeats": {
    "operational_locus": "plane-existence--variables.md",
    "formal_locus": "derivation--plane-existence",
    "governance_locus": "GH-#8"
  }
}
