{
  "uid": "ent_82A43",
  "type": "axiom",
  "expression": {
    "name": "System Energy",
    "slug": "axiom--energy",
    "aliases": []
  },
  "created_at": "2026-04-05T17:20:30.222383+00:00",
  "heartbeats": {
    "operational_locus": "system--energy.md",
    "formal_locus": "Law-5",
    "governance_locus": "GH-#7"
  }
}
