{
  "uid": "ent_F70D1",
  "type": "derivation",
  "expression": {
    "name": "Self-Inclusion and Shadow Instances",
    "slug": "derivation--self-inclusion",
    "aliases": []
  },
  "created_at": "2026-04-05T17:20:42.724372+00:00",
  "heartbeats": {
    "operational_locus": "self-inclusion--shadow-instances.md",
    "formal_locus": "derivation--self-inclusion",
    "governance_locus": "GH-#1"
  }
}
