{
  "uid": "ent_C33B9",
  "type": "seed",
  "expression": {
    "name": "Challenge Statement",
    "slug": "seed--challenge-statement",
    "aliases": []
  },
  "created_at": "2026-04-07T16:07:23.068538+00:00",
  "heartbeats": {
    "operational_locus": "challenge--statement.md",
    "formal_locus": "ATM-S-001:ATM-S-003",
    "governance_locus": "GH-#7"
  }
}