{
  "uid": "ent_E7D9B",
  "type": "derivation",
  "expression": {
    "name": "Subsumption of External Primitive-Framings",
    "slug": "derivation--subsumption-external-primitives",
    "aliases": []
  },
  "created_at": "2026-04-05T15:30:00-04:00",
  "heartbeats": {
    "operational_locus": "subsumption--external-primitives.md",
    "formal_locus": "derivation--subsumption-external-primitives",
    "governance_locus": "VACUUM"
  }
}
