{
  "uid": "ent_67C08",
  "type": "derivation",
  "expression": {
    "name": "Gap Analysis \u2014 Cartography",
    "slug": "derivation--gap-analysis",
    "aliases": []
  },
  "created_at": "2026-04-05T17:20:50.103572+00:00",
  "heartbeats": {
    "operational_locus": "gap-analysis--cartography.md",
    "formal_locus": "derivation--gap-analysis",
    "governance_locus": "GH-#8"
  }
}
