{
  "uid": "ent_BEDF9",
  "type": "derivation",
  "expression": {
    "name": "Multiverse Pipeline",
    "slug": "derivation--multiverse-pipeline",
    "aliases": []
  },
  "created_at": "2026-04-05T17:20:45.797196+00:00",
  "heartbeats": {
    "operational_locus": "multiverse--pipeline.md",
    "formal_locus": "ATM-V-001:ATM-V-007",
    "governance_locus": "GH-#8"
  }
}
