{
  "uid": "ent_B7087",
  "type": "document",
  "expression": {
    "name": "Ontological Cartography",
    "slug": "document--ontological-cartography",
    "aliases": []
  },
  "created_at": "2026-04-07T16:07:29.630715+00:00",
  "heartbeats": {
    "operational_locus": "ontological-cartography.md",
    "formal_locus": "Law-6",
    "governance_locus": "GH-#7"
  }
}