{
  "uid": "ent_A4F0D",
  "type": "derivation",
  "expression": {
    "name": "Universal Rendering Thesis",
    "slug": "derivation--urt",
    "aliases": []
  },
  "created_at": "2026-04-05T17:20:41.703439+00:00",
  "heartbeats": {
    "operational_locus": "universal-rendering--thesis.md",
    "formal_locus": "derivation--urt",
    "governance_locus": "GH-#8"
  }
}
