{
  "uid": "ent_3B709",
  "type": "derivation",
  "expression": {
    "name": "Materon Formalization",
    "slug": "derivation--materon",
    "aliases": []
  },
  "created_at": "2026-04-05T17:20:40.748824+00:00",
  "heartbeats": {
    "operational_locus": "materon--formalization.md",
    "formal_locus": "ATM-M-005:ATM-M-021",
    "governance_locus": "GH-#5"
  }
}
