{
  "uid": "ent_9DC44",
  "type": "derivation",
  "expression": {
    "name": "Primitives Classification",
    "slug": "derivation--primitives-classification",
    "aliases": []
  },
  "created_at": "2026-04-05T17:20:49.001361+00:00",
  "heartbeats": {
    "operational_locus": "primitives--classification.md",
    "formal_locus": "derivation--primitives-classification",
    "governance_locus": "GH-#8"
  }
}
